{
  "id": "recipe:hello-python-receiver",
  "mappings": [
    {"source": "payload/greeting.py", "target": "_vendor/greeting.py"}
  ],
  "offerRef": {
    "capsuleDigest": "sha256:e0fbe3f7d9b95fec77107f6e52b62fa55b3e3b7d5c031d897d50e5d8c49548d3",
    "offerId": "offer:hello-python-exact"
  },
  "recipeDigest": "sha256:5405ac85e7ce90796d1224690704d0e8322712c206c5417036fac109cc8cc7dc",
  "schemaVersion": "limitless.recipe/0.1",
  "verifiers": [
    {
      "argv": ["{python}", "/work/verify/adherence.py"],
      "id": "runtime-adherence",
      "kind": "adherence",
      "maxWallSeconds": 10,
      "source": {
        "digest": "sha256:ad7909de78823cbee14cea090164d6fee16a5c6c7ae721b43818aa348e5a0827",
        "path": "verify/adherence.py"
      }
    },
    {
      "argv": ["{python}", "/work/verify/obligations.py"],
      "id": "receiver-obligations",
      "kind": "obligation",
      "maxWallSeconds": 10,
      "source": {
        "digest": "sha256:052d601c02d37023e0139c2637325ad04c77a95b5c0d0b28a793b4b8733d44e1",
        "path": "verify/obligations.py"
      }
    }
  ]
}
